{
  "$schema": "http://json-schema.org/draft-07/schema#",
  "$id": "https://resqnet/contracts/telemetry.schema.json",
  "title": "DroneTelemetry",
  "description": "Per-tick telemetry packet emitted by a drone agent (simulated in Phase 1, real MAVLink adapter in Phase 2). Owner: Chirag. Co-sign required on altitude_m, heading_deg, gimbal_pitch_deg from Atul (geolocation math consumes these directly). This schema is FROZEN for Week 1 — any change requires sign-off from both owners per Section 16 of the Team Role Distribution plan.",
  "type": "object",
  "additionalProperties": false,
  "required": [
    "drone_id",
    "sector_id",
    "timestamp",
    "lat",
    "lon",
    "altitude_m",
    "heading_deg",
    "gimbal_pitch_deg",
    "frame_ref"
  ],
  "properties": {
    "drone_id": {
      "type": "string",
      "pattern": "^DRONE-[0-9]{2}$",
      "description": "Stable identifier for the drone agent, e.g. DRONE-01."
    },
    "sector_id": {
      "type": "string",
      "pattern": "^SECTOR-[A-Z]$",
      "description": "The search sector this drone is currently assigned to, e.g. SECTOR-A."
    },
    "timestamp": {
      "type": "string",
      "format": "date-time",
      "description": "ISO-8601 UTC timestamp of this telemetry sample."
    },
    "lat": {
      "type": "number",
      "minimum": -90,
      "maximum": 90,
      "description": "Drone GPS latitude, decimal degrees."
    },
    "lon": {
      "type": "number",
      "minimum": -180,
      "maximum": 180,
      "description": "Drone GPS longitude, decimal degrees."
    },
    "altitude_m": {
      "type": "number",
      "minimum": 0,
      "maximum": 500,
      "description": "Altitude above ground level, meters. Co-signed: Atul (geolocation projection math)."
    },
    "heading_deg": {
      "type": "number",
      "minimum": 0,
      "exclusiveMaximum": 360,
      "description": "Drone yaw/heading, compass degrees. Co-signed: Atul."
    },
    "gimbal_pitch_deg": {
      "type": "number",
      "minimum": -90,
      "maximum": 0,
      "description": "Camera gimbal pitch, degrees (0 = level, -90 = straight down). Co-signed: Atul."
    },
    "frame_ref": {
      "type": "string",
      "description": "Reference/pointer to the frame captured at this tick (filename or storage key), NOT inline binary. Renamed from PRD's 'frame' to make explicit this is a pointer only, keeping the socket payload small.",
      "examples": ["frame_00234.jpg"]
    },
    "battery_pct": {
      "type": "number",
      "minimum": 0,
      "maximum": 100,
      "description": "Remaining battery percentage reported by the flight controller."
    },
    "armed": {
      "type": "boolean",
      "description": "Current armed state reported by the flight controller."
    },
    "flight_mode": {
      "type": "string",
      "description": "Current flight mode reported by the flight controller."
    },
    "gps_healthy": {
      "type": "boolean",
      "description": "Whether the flight controller reports a usable GPS fix."
    }
  }
}
