[
  {
    "drone_id": "DRONE-01",
    "sector_id": "SECTOR-A",
    "timestamp": "2026-08-27T10:30:00.000Z",
    "lat": 28.6115,
    "lon": 77.2,
    "altitude_m": 80,
    "heading_deg": 90,
    "gimbal_pitch_deg": -90,
    "frame_ref": "frame_00001.jpg"
  },
  {
    "drone_id": "DRONE-02",
    "sector_id": "SECTOR-B",
    "timestamp": "2026-08-27T10:30:00.000Z",
    "lat": 28.6165,
    "lon": 77.2,
    "altitude_m": 80,
    "heading_deg": 90,
    "gimbal_pitch_deg": -90,
    "frame_ref": "frame_00002.jpg"
  },
  {
    "drone_id": "DRONE-03",
    "sector_id": "SECTOR-C",
    "timestamp": "2026-08-27T10:30:00.000Z",
    "lat": 28.613,
    "lon": 77.21,
    "altitude_m": 80,
    "heading_deg": 90,
    "gimbal_pitch_deg": -90,
    "frame_ref": "frame_00003.jpg"
  },
  {
    "drone_id": "DRONE-01",
    "sector_id": "SECTOR-A",
    "timestamp": "2026-08-27T10:30:01.000Z",
    "lat": 28.6116,
    "lon": 77.2005,
    "altitude_m": 80,
    "heading_deg": 90,
    "gimbal_pitch_deg": -90,
    "frame_ref": "frame_00004.jpg"
  },
  {
    "drone_id": "DRONE-02",
    "sector_id": "SECTOR-B",
    "timestamp": "2026-08-27T10:30:01.000Z",
    "lat": 28.6166,
    "lon": 77.2005,
    "altitude_m": 80,
    "heading_deg": 90,
    "gimbal_pitch_deg": -90,
    "frame_ref": "frame_00005.jpg"
  },
  {
    "drone_id": "DRONE-03",
    "sector_id": "SECTOR-C",
    "timestamp": "2026-08-27T10:30:01.000Z",
    "lat": 28.6132,
    "lon": 77.2105,
    "altitude_m": 80,
    "heading_deg": 90,
    "gimbal_pitch_deg": -90,
    "frame_ref": "frame_00006.jpg"
  },
  {
    "drone_id": "DRONE-01",
    "sector_id": "SECTOR-A",
    "timestamp": "2026-08-27T10:30:02.000Z",
    "lat": 28.6117,
    "lon": 77.201,
    "altitude_m": 80,
    "heading_deg": 90,
    "gimbal_pitch_deg": -90,
    "frame_ref": "frame_00007.jpg"
  },
  {
    "drone_id": "DRONE-02",
    "sector_id": "SECTOR-B",
    "timestamp": "2026-08-27T10:30:02.000Z",
    "lat": 28.6167,
    "lon": 77.201,
    "altitude_m": 80,
    "heading_deg": 90,
    "gimbal_pitch_deg": -90,
    "frame_ref": "frame_00008.jpg"
  },
  {
    "drone_id": "DRONE-03",
    "sector_id": "SECTOR-C",
    "timestamp": "2026-08-27T10:30:02.000Z",
    "lat": 28.6134,
    "lon": 77.211,
    "altitude_m": 80,
    "heading_deg": 90,
    "gimbal_pitch_deg": -90,
    "frame_ref": "frame_00009.jpg"
  },
  {
    "drone_id": "DRONE-01",
    "sector_id": "SECTOR-A",
    "timestamp": "2026-08-27T10:30:03.000Z",
    "lat": 28.6118,
    "lon": 77.2015,
    "altitude_m": 80,
    "heading_deg": 90,
    "gimbal_pitch_deg": -90,
    "frame_ref": "frame_00010.jpg"
  },
  {
    "drone_id": "DRONE-02",
    "sector_id": "SECTOR-B",
    "timestamp": "2026-08-27T10:30:03.000Z",
    "lat": 28.6168,
    "lon": 77.2015,
    "altitude_m": 80,
    "heading_deg": 90,
    "gimbal_pitch_deg": -90,
    "frame_ref": "frame_00011.jpg"
  },
  {
    "drone_id": "DRONE-03",
    "sector_id": "SECTOR-C",
    "timestamp": "2026-08-27T10:30:03.000Z",
    "lat": 28.6136,
    "lon": 77.2115,
    "altitude_m": 80,
    "heading_deg": 90,
    "gimbal_pitch_deg": -90,
    "frame_ref": "frame_00012.jpg"
  },
  {
    "drone_id": "DRONE-01",
    "sector_id": "SECTOR-A",
    "timestamp": "2026-08-27T10:30:04.000Z",
    "lat": 28.6119,
    "lon": 77.202,
    "altitude_m": 80,
    "heading_deg": 90,
    "gimbal_pitch_deg": -90,
    "frame_ref": "frame_00013.jpg"
  },
  {
    "drone_id": "DRONE-02",
    "sector_id": "SECTOR-B",
    "timestamp": "2026-08-27T10:30:04.000Z",
    "lat": 28.6169,
    "lon": 77.202,
    "altitude_m": 80,
    "heading_deg": 90,
    "gimbal_pitch_deg": -90,
    "frame_ref": "frame_00014.jpg"
  },
  {
    "drone_id": "DRONE-03",
    "sector_id": "SECTOR-C",
    "timestamp": "2026-08-27T10:30:04.000Z",
    "lat": 28.6138,
    "lon": 77.212,
    "altitude_m": 80,
    "heading_deg": 90,
    "gimbal_pitch_deg": -90,
    "frame_ref": "frame_00015.jpg"
  },
  {
    "drone_id": "DRONE-01",
    "sector_id": "SECTOR-A",
    "timestamp": "2026-08-27T10:30:05.000Z",
    "lat": 28.612,
    "lon": 77.2025,
    "altitude_m": 80,
    "heading_deg": 90,
    "gimbal_pitch_deg": -90,
    "frame_ref": "frame_00016.jpg"
  },
  {
    "drone_id": "DRONE-02",
    "sector_id": "SECTOR-B",
    "timestamp": "2026-08-27T10:30:05.000Z",
    "lat": 28.617,
    "lon": 77.2025,
    "altitude_m": 80,
    "heading_deg": 90,
    "gimbal_pitch_deg": -90,
    "frame_ref": "frame_00017.jpg"
  },
  {
    "drone_id": "DRONE-03",
    "sector_id": "SECTOR-C",
    "timestamp": "2026-08-27T10:30:05.000Z",
    "lat": 28.614,
    "lon": 77.2125,
    "altitude_m": 80,
    "heading_deg": 90,
    "gimbal_pitch_deg": -90,
    "frame_ref": "frame_00018.jpg"
  },
  {
    "drone_id": "DRONE-01",
    "sector_id": "SECTOR-A",
    "timestamp": "2026-08-27T10:30:06.000Z",
    "lat": 28.6121,
    "lon": 77.203,
    "altitude_m": 80,
    "heading_deg": 90,
    "gimbal_pitch_deg": -90,
    "frame_ref": "frame_00019.jpg"
  },
  {
    "drone_id": "DRONE-02",
    "sector_id": "SECTOR-B",
    "timestamp": "2026-08-27T10:30:06.000Z",
    "lat": 28.6171,
    "lon": 77.203,
    "altitude_m": 80,
    "heading_deg": 90,
    "gimbal_pitch_deg": -90,
    "frame_ref": "frame_00020.jpg"
  },
  {
    "drone_id": "DRONE-03",
    "sector_id": "SECTOR-C",
    "timestamp": "2026-08-27T10:30:06.000Z",
    "lat": 28.6142,
    "lon": 77.213,
    "altitude_m": 80,
    "heading_deg": 90,
    "gimbal_pitch_deg": -90,
    "frame_ref": "frame_00021.jpg"
  },
  {
    "drone_id": "DRONE-01",
    "sector_id": "SECTOR-A",
    "timestamp": "2026-08-27T10:30:07.000Z",
    "lat": 28.6122,
    "lon": 77.2035,
    "altitude_m": 80,
    "heading_deg": 90,
    "gimbal_pitch_deg": -90,
    "frame_ref": "frame_00022.jpg"
  },
  {
    "drone_id": "DRONE-02",
    "sector_id": "SECTOR-B",
    "timestamp": "2026-08-27T10:30:07.000Z",
    "lat": 28.6172,
    "lon": 77.2035,
    "altitude_m": 80,
    "heading_deg": 90,
    "gimbal_pitch_deg": -90,
    "frame_ref": "frame_00023.jpg"
  },
  {
    "drone_id": "DRONE-03",
    "sector_id": "SECTOR-C",
    "timestamp": "2026-08-27T10:30:07.000Z",
    "lat": 28.6144,
    "lon": 77.2135,
    "altitude_m": 80,
    "heading_deg": 90,
    "gimbal_pitch_deg": -90,
    "frame_ref": "frame_00024.jpg"
  },
  {
    "drone_id": "DRONE-01",
    "sector_id": "SECTOR-A",
    "timestamp": "2026-08-27T10:30:08.000Z",
    "lat": 28.6123,
    "lon": 77.204,
    "altitude_m": 80,
    "heading_deg": 90,
    "gimbal_pitch_deg": -90,
    "frame_ref": "frame_00025.jpg"
  },
  {
    "drone_id": "DRONE-02",
    "sector_id": "SECTOR-B",
    "timestamp": "2026-08-27T10:30:08.000Z",
    "lat": 28.6173,
    "lon": 77.204,
    "altitude_m": 80,
    "heading_deg": 90,
    "gimbal_pitch_deg": -90,
    "frame_ref": "frame_00026.jpg"
  },
  {
    "drone_id": "DRONE-03",
    "sector_id": "SECTOR-C",
    "timestamp": "2026-08-27T10:30:08.000Z",
    "lat": 28.6146,
    "lon": 77.214,
    "altitude_m": 80,
    "heading_deg": 90,
    "gimbal_pitch_deg": -90,
    "frame_ref": "frame_00027.jpg"
  },
  {
    "drone_id": "DRONE-01",
    "sector_id": "SECTOR-A",
    "timestamp": "2026-08-27T10:30:09.000Z",
    "lat": 28.6124,
    "lon": 77.2045,
    "altitude_m": 80,
    "heading_deg": 90,
    "gimbal_pitch_deg": -90,
    "frame_ref": "frame_00028.jpg"
  },
  {
    "drone_id": "DRONE-02",
    "sector_id": "SECTOR-B",
    "timestamp": "2026-08-27T10:30:09.000Z",
    "lat": 28.6174,
    "lon": 77.2045,
    "altitude_m": 80,
    "heading_deg": 90,
    "gimbal_pitch_deg": -90,
    "frame_ref": "frame_00029.jpg"
  },
  {
    "drone_id": "DRONE-03",
    "sector_id": "SECTOR-C",
    "timestamp": "2026-08-27T10:30:09.000Z",
    "lat": 28.6148,
    "lon": 77.2145,
    "altitude_m": 80,
    "heading_deg": 90,
    "gimbal_pitch_deg": -90,
    "frame_ref": "frame_00030.jpg"
  },
  {
    "drone_id": "DRONE-01",
    "sector_id": "SECTOR-A",
    "timestamp": "2026-08-27T10:30:10.000Z",
    "lat": 28.6125,
    "lon": 77.205,
    "altitude_m": 80,
    "heading_deg": 90,
    "gimbal_pitch_deg": -90,
    "frame_ref": "frame_00031.jpg"
  },
  {
    "drone_id": "DRONE-02",
    "sector_id": "SECTOR-B",
    "timestamp": "2026-08-27T10:30:10.000Z",
    "lat": 28.6175,
    "lon": 77.205,
    "altitude_m": 80,
    "heading_deg": 90,
    "gimbal_pitch_deg": -90,
    "frame_ref": "frame_00032.jpg"
  },
  {
    "drone_id": "DRONE-03",
    "sector_id": "SECTOR-C",
    "timestamp": "2026-08-27T10:30:10.000Z",
    "lat": 28.615,
    "lon": 77.215,
    "altitude_m": 80,
    "heading_deg": 90,
    "gimbal_pitch_deg": -90,
    "frame_ref": "frame_00033.jpg"
  },
  {
    "drone_id": "DRONE-01",
    "sector_id": "SECTOR-A",
    "timestamp": "2026-08-27T10:30:11.000Z",
    "lat": 28.6126,
    "lon": 77.2055,
    "altitude_m": 80,
    "heading_deg": 90,
    "gimbal_pitch_deg": -90,
    "frame_ref": "frame_00034.jpg"
  },
  {
    "drone_id": "DRONE-02",
    "sector_id": "SECTOR-B",
    "timestamp": "2026-08-27T10:30:11.000Z",
    "lat": 28.6176,
    "lon": 77.2055,
    "altitude_m": 80,
    "heading_deg": 90,
    "gimbal_pitch_deg": -90,
    "frame_ref": "frame_00035.jpg"
  },
  {
    "drone_id": "DRONE-03",
    "sector_id": "SECTOR-C",
    "timestamp": "2026-08-27T10:30:11.000Z",
    "lat": 28.6152,
    "lon": 77.2155,
    "altitude_m": 80,
    "heading_deg": 90,
    "gimbal_pitch_deg": -90,
    "frame_ref": "frame_00036.jpg"
  },
  {
    "drone_id": "DRONE-01",
    "sector_id": "SECTOR-A",
    "timestamp": "2026-08-27T10:30:12.000Z",
    "lat": 28.6127,
    "lon": 77.206,
    "altitude_m": 80,
    "heading_deg": 90,
    "gimbal_pitch_deg": -90,
    "frame_ref": "frame_00037.jpg"
  },
  {
    "drone_id": "DRONE-02",
    "sector_id": "SECTOR-B",
    "timestamp": "2026-08-27T10:30:12.000Z",
    "lat": 28.6177,
    "lon": 77.206,
    "altitude_m": 80,
    "heading_deg": 90,
    "gimbal_pitch_deg": -90,
    "frame_ref": "frame_00038.jpg"
  },
  {
    "drone_id": "DRONE-03",
    "sector_id": "SECTOR-C",
    "timestamp": "2026-08-27T10:30:12.000Z",
    "lat": 28.6154,
    "lon": 77.216,